{
  "uacp": "0.6.0",
  "id": "tv_36_tokens_metadata",
  "tool": "claude",
  "title": "Messages with token counts on assistant messages",
  "created_at": "2026-05-09T10:14:00.000Z",
  "updated_at": "2026-05-09T10:14:45.000Z",
  "messages": [
    {
      "id": "msg_1",
      "role": "user",
      "content": "Explain the difference between supervised and unsupervised learning.",
      "timestamp": "2026-05-09T10:14:01.000Z"
    },
    {
      "id": "msg_2",
      "role": "assistant",
      "parent_id": "msg_1",
      "content": "Supervised learning uses labeled training data — the model learns a mapping from inputs to known outputs. Unsupervised learning finds patterns in unlabeled data, such as clustering or dimensionality reduction, without predefined target labels.",
      "timestamp": "2026-05-09T10:14:10.000Z",
      "model": "claude-opus-4-7",
      "tokens": { "input": 150, "output": 320 }
    },
    {
      "id": "msg_3",
      "role": "user",
      "parent_id": "msg_2",
      "content": "Give me a real-world example of each.",
      "timestamp": "2026-05-09T10:14:20.000Z"
    },
    {
      "id": "msg_4",
      "role": "assistant",
      "parent_id": "msg_3",
      "content": "Supervised: email spam detection — trained on emails labeled spam/not-spam. Unsupervised: customer segmentation — grouping customers by purchasing behavior without predefined categories.",
      "timestamp": "2026-05-09T10:14:35.000Z",
      "model": "claude-opus-4-7",
      "tokens": { "input": 480, "output": 210 }
    }
  ]
}
