{
  "uacp": "0.2.0",
  "id": "tv_05_branch",
  "tool": "chatgpt",
  "title": "Branched conversation",
  "privacy": "personal",
  "created_at": "2026-04-21T13:00:00Z",
  "updated_at": "2026-04-21T13:05:00Z",
  "branches": ["msg_4_alt"],
  "messages": [
    { "id": "msg_1", "role": "user", "content": "Explain recursion", "timestamp": "2026-04-21T13:00:01Z" },
    { "id": "msg_2", "role": "assistant", "parent_id": "msg_1", "content": "Recursion is when a function calls itself.", "timestamp": "2026-04-21T13:00:03Z" },
    { "id": "msg_3", "role": "user", "parent_id": "msg_2", "content": "Give me a code example.", "timestamp": "2026-04-21T13:01:00Z" },
    { "id": "msg_4", "role": "assistant", "parent_id": "msg_3", "content": "def factorial(n):\n    return 1 if n <= 1 else n * factorial(n-1)", "timestamp": "2026-04-21T13:01:05Z" }
  ],
  "metadata": {
    "uacp.branch_nodes": [
      { "id": "msg_4_alt", "parent_id": "msg_3", "role": "assistant", "content": "function fib(n) { return n <= 1 ? n : fib(n-1) + fib(n-2); }" }
    ]
  }
}
