{
  "uacp": "0.6.0",
  "id": "tv_46_file_content_block",
  "tool": "test-harness",
  "title": "File content block with url, filename, and size_bytes",
  "created_at": "2026-05-09T12:02:00.000Z",
  "updated_at": "2026-05-09T12:02:25.000Z",
  "messages": [
    {
      "id": "msg_1",
      "role": "user",
      "content": [
        { "type": "text", "text": "Please review this spreadsheet and summarize the data." },
        {
          "type": "file",
          "url": "https://example.com/data/sales-q1.csv",
          "filename": "sales-q1.csv",
          "mime_type": "text/csv",
          "size_bytes": 8192
        }
      ],
      "timestamp": "2026-05-09T12:02:01.000Z"
    },
    {
      "id": "msg_2",
      "role": "assistant",
      "parent_id": "msg_1",
      "content": "The CSV file contains Q1 sales data with 3 columns: date, product, and revenue. There are 120 rows covering January through March, with total revenue of $48,320.",
      "timestamp": "2026-05-09T12:02:20.000Z"
    }
  ]
}
