{
  "uacp": "0.6.0",
  "id": "tv_50_all_message_roles",
  "tool": "test-harness",
  "title": "Conversation using all four message roles: system, user, assistant, tool",
  "created_at": "2026-05-09T12:06:00.000Z",
  "updated_at": "2026-05-09T12:07:00.000Z",
  "messages": [
    {
      "id": "msg_sys",
      "role": "system",
      "content": "You are a concise assistant. Always use tools when available.",
      "timestamp": "2026-05-09T12:06:00.000Z"
    },
    {
      "id": "msg_user",
      "role": "user",
      "parent_id": "msg_sys",
      "content": "List all files in the current directory.",
      "timestamp": "2026-05-09T12:06:05.000Z"
    },
    {
      "id": "msg_asst",
      "role": "assistant",
      "parent_id": "msg_user",
      "content": "I'll list the directory contents now.",
      "timestamp": "2026-05-09T12:06:07.000Z",
      "tool_calls": [
        { "call_id": "call_ls", "name": "list_directory", "arguments": { "path": "." } }
      ]
    },
    {
      "id": "msg_tool",
      "role": "tool",
      "parent_id": "msg_asst",
      "content": "README.md\npackage.json\nsrc/\ntests/",
      "call_id": "call_ls",
      "name": "list_directory",
      "timestamp": "2026-05-09T12:06:09.000Z"
    },
    {
      "id": "msg_final",
      "role": "assistant",
      "parent_id": "msg_tool",
      "content": "The current directory contains: README.md, package.json, src/, tests/.",
      "timestamp": "2026-05-09T12:06:12.000Z"
    }
  ]
}
