{
  "uacp": "0.6.0",
  "id": "tv_25_tool_array_format",
  "tool": ["chatgpt", "claude"],
  "title": "Tool field as an array of tool names",
  "created_at": "2026-05-09T10:03:00.000Z",
  "updated_at": "2026-05-09T10:03:30.000Z",
  "messages": [
    {
      "id": "msg_1",
      "role": "user",
      "content": "What are the pros and cons of TypeScript?",
      "timestamp": "2026-05-09T10:03:01.000Z"
    },
    {
      "id": "msg_2",
      "role": "assistant",
      "parent_id": "msg_1",
      "content": "TypeScript adds static typing to JavaScript, catching errors at compile time. Pros: better IDE support, safer refactoring, self-documenting code. Cons: additional build step, slower compilation, steeper learning curve.",
      "timestamp": "2026-05-09T10:03:08.000Z"
    }
  ]
}
