{
  "uacp": "0.6.0",
  "id": "tv_31_audio_content_block",
  "tool": "chatgpt",
  "title": "Message with audio content block",
  "created_at": "2026-05-09T10:09:00.000Z",
  "updated_at": "2026-05-09T10:09:15.000Z",
  "messages": [
    {
      "id": "msg_1",
      "role": "user",
      "content": [
        { "type": "text", "text": "Please transcribe this audio recording." },
        {
          "type": "audio",
          "url": "https://example.com/audio.mp3",
          "mime_type": "audio/mpeg",
          "duration_s": 45.2,
          "filename": "recording.mp3"
        }
      ],
      "timestamp": "2026-05-09T10:09:01.000Z"
    },
    {
      "id": "msg_2",
      "role": "assistant",
      "parent_id": "msg_1",
      "content": "Transcription: \"Good morning everyone, welcome to the weekly standup. Let's go around and share our updates.\"",
      "timestamp": "2026-05-09T10:09:10.000Z"
    }
  ]
}
