{
  "uacp": "0.6.0",
  "id": "tv_51_artifact_all_types",
  "tool": "test-harness",
  "title": "One artifact of each valid type: code, html, svg, markdown, react, text",
  "created_at": "2026-05-09T12:07:00.000Z",
  "updated_at": "2026-05-09T12:07:45.000Z",
  "messages": [
    {
      "id": "msg_1",
      "role": "user",
      "content": "Show me examples of every artifact type.",
      "timestamp": "2026-05-09T12:07:01.000Z"
    },
    {
      "id": "msg_2",
      "role": "assistant",
      "parent_id": "msg_1",
      "content": [
        { "type": "text", "text": "Here are examples of all six artifact types:" },
        { "type": "artifact_ref", "id": "art_code" },
        { "type": "artifact_ref", "id": "art_html" },
        { "type": "artifact_ref", "id": "art_svg" },
        { "type": "artifact_ref", "id": "art_md" },
        { "type": "artifact_ref", "id": "art_react" },
        { "type": "artifact_ref", "id": "art_text" }
      ],
      "timestamp": "2026-05-09T12:07:40.000Z",
      "artifacts": [
        {
          "id": "art_code",
          "type": "code",
          "title": "hello.py",
          "language": "python",
          "content": "print('Hello, world!')",
          "created_at": "2026-05-09T12:07:40.000Z",
          "updated_at": "2026-05-09T12:07:40.000Z"
        },
        {
          "id": "art_html",
          "type": "html",
          "title": "hello.html",
          "content": "<!DOCTYPE html><html><body><h1>Hello</h1></body></html>",
          "created_at": "2026-05-09T12:07:40.000Z",
          "updated_at": "2026-05-09T12:07:40.000Z"
        },
        {
          "id": "art_svg",
          "type": "svg",
          "title": "circle.svg",
          "content": "<svg xmlns=\"http://www.w3.org/2000/svg\" width=\"100\" height=\"100\"><circle cx=\"50\" cy=\"50\" r=\"40\" fill=\"blue\"/></svg>",
          "created_at": "2026-05-09T12:07:40.000Z",
          "updated_at": "2026-05-09T12:07:40.000Z"
        },
        {
          "id": "art_md",
          "type": "markdown",
          "title": "notes.md",
          "content": "# Notes\n\nThis is a markdown artifact.",
          "created_at": "2026-05-09T12:07:40.000Z",
          "updated_at": "2026-05-09T12:07:40.000Z"
        },
        {
          "id": "art_react",
          "type": "react",
          "title": "Button.jsx",
          "content": "export default function Button() { return <button>Click me</button>; }",
          "created_at": "2026-05-09T12:07:40.000Z",
          "updated_at": "2026-05-09T12:07:40.000Z"
        },
        {
          "id": "art_text",
          "type": "text",
          "title": "notes.txt",
          "content": "Plain text artifact content.",
          "created_at": "2026-05-09T12:07:40.000Z",
          "updated_at": "2026-05-09T12:07:40.000Z"
        }
      ]
    }
  ]
}
