{
  "uacp": "0.3.0",
  "id": "tv_14_tool_call_correlation",
  "tool": "claude-ai",
  "created_at": "2026-04-24T10:00:00.000Z",
  "updated_at": "2026-04-24T10:00:10.000Z",
  "messages": [
    { "id": "m_1", "role": "user", "content": "What's the weather in Jerusalem?" },
    {
      "id": "m_2",
      "role": "assistant",
      "content": [{ "type": "text", "text": "Let me check." }],
      "tool_calls": [
        {
          "call_id": "call_abc123",
          "name": "get_weather",
          "arguments": { "city": "Jerusalem", "units": "metric" }
        }
      ]
    },
    {
      "id": "m_3",
      "role": "tool",
      "name": "get_weather",
      "call_id": "call_abc123",
      "content": "22°C, clear"
    },
    {
      "id": "m_4",
      "role": "assistant",
      "content": "It's 22°C and clear in Jerusalem right now."
    }
  ],
  "metadata": {
    "uacp.test.expect": "valid",
    "uacp.test.comment": "Tool call + paired tool result. call_id links the assistant's tool_call to the tool message. Every tool_call MUST have at most one tool-role message with matching call_id."
  }
}
