{
  "uacp": "0.6.0",
  "id": "tv_55_model_snapshot_date",
  "tool": "test-harness",
  "model": { "id": "claude-opus-4-7", "provider": "anthropic", "snapshot_date": "2025-01-15" },
  "title": "Model as object with snapshot_date to pin a specific model version",
  "created_at": "2026-05-09T12:11:00.000Z",
  "updated_at": "2026-05-09T12:11:30.000Z",
  "messages": [
    {
      "id": "msg_1",
      "role": "user",
      "content": "What is 2 + 2?",
      "timestamp": "2026-05-09T12:11:01.000Z"
    },
    {
      "id": "msg_2",
      "role": "assistant",
      "parent_id": "msg_1",
      "content": "2 + 2 equals 4.",
      "timestamp": "2026-05-09T12:11:05.000Z",
      "model": { "id": "claude-opus-4-7", "provider": "anthropic", "snapshot_date": "2025-01-15" }
    }
  ]
}
